{
  "arbitration_id": "omens_01",
  "context": {
    "context_id": "omens_01",
    "scene_type": "omens_choice",
    "floor": 6,
    "act": 1,
    "resources": {
      "health": 5,
      "max_health": 10,
      "money": 6,
      "sanity": 5
    },
    "tags": ["branching_path", "temptation", "omens"],
    "metadata": {
      "scene_summary": "At the river crossing, a ferryman offers one safe route, while a second path follows bells no one else seems to hear.",
      "sanity_question": "Do you pay for certainty, chase the omen, or retreat before the choice worsens?"
    }
  },
  "options": [
    {
      "option_id": "pay_ferryman",
      "label": "Pay the ferryman and cross under guard",
      "tags": ["safe", "ordered", "costly"],
      "metadata": {
        "effects": {
          "money_delta": -1,
          "add_events": ["The ferryman refused to meet your eyes, but he got you across."]
        }
      }
    },
    {
      "option_id": "follow_bells",
      "label": "Follow the bells into the marsh",
      "tags": ["uncertain", "occult", "volatile", "greedy"],
      "metadata": {
        "effects": {
          "health_delta": -1,
          "sanity_delta": -2,
          "add_conditions": ["marsh_bells"],
          "add_events": ["You found the bells. You still do not know who was ringing them."]
        }
      }
    },
    {
      "option_id": "retreat",
      "label": "Step back and camp before dusk",
      "tags": ["safe", "restraint", "grounded"],
      "metadata": {
        "effects": {
          "health_delta": 1,
          "add_events": ["You gave the river one more night to decide whether it wanted you."]
        }
      }
    }
  ],
  "metadata": {
    "owner_hint": "node",
    "asset_note": "Omens-choice arbitration sample."
  }
}
